{
  "schema": "trial/1",
  "trial": "P-12",
  "question": "Does a check run's external_id round-trip, so it can serve as a recovery key?",
  "pass": "Yes",
  "repo": "combsmith/software-factory-canary",
  "ran_at": "2026-10-15T14:02:11Z",
  "exchanges": [
    {
      "request": {
        "as": {
          "kind": "app",
          "name": "combsmith-sf-trial"
        },
        "via": "rest",
        "call": "POST /repos/combsmith/software-factory-canary/check-runs",
        "headers": {
          "accept": "application/vnd.github+json",
          "x-github-api-version": "2022-11-28"
        },
        "body": {
          "name": "trial-p-12",
          "head_sha": "6dcb09b5b57875f334f61aebed695e2e4193db5e",
          "external_id": "factory-run-r1"
        }
      },
      "response": {
        "status": 201,
        "headers": {
          "content-type": "application/json; charset=utf-8",
          "x-ratelimit-remaining": "4999"
        },
        "body": {
          "id": 4,
          "head_sha": "6dcb09b5b57875f334f61aebed695e2e4193db5e",
          "external_id": "factory-run-r1",
          "name": "trial-p-12",
          "status": "queued",
          "conclusion": null,
          "app": {
            "slug": "combsmith-sf-trial"
          }
        }
      }
    },
    {
      "request": {
        "as": {
          "kind": "app",
          "name": "combsmith-sf-trial"
        },
        "via": "rest",
        "call": "GET /repos/combsmith/software-factory-canary/check-runs/4",
        "headers": {
          "accept": "application/vnd.github+json",
          "x-github-api-version": "2022-11-28"
        },
        "body": null
      },
      "response": {
        "status": 200,
        "headers": {
          "content-type": "application/json; charset=utf-8",
          "x-ratelimit-remaining": "4998"
        },
        "body": {
          "id": 4,
          "head_sha": "6dcb09b5b57875f334f61aebed695e2e4193db5e",
          "external_id": "factory-run-r1",
          "name": "trial-p-12",
          "status": "queued",
          "conclusion": null,
          "app": {
            "slug": "combsmith-sf-trial"
          }
        }
      }
    }
  ],
  "removed": [
    "exchanges[0].request.headers.authorization",
    "exchanges[1].request.headers.authorization"
  ],
  "verdict": "pass"
}
